film_id,genre,director_name,title,length,rating
7338,comedy,Lisa Santiago,He animal travel peace.,0.44,43.87315088870217
7339,documentary,Melvin Freeman,Republican suddenly smile fine.,1.99,42.65851124508062
7340,romance,Mark Cole,Radio forward animal they.,1.12,42.65295570543299
7341,romance,Joseph English,National loss wonder home instead support hotel.,1.82,57.40472711160333
7342,documentary,Jacob Reyes,Continue seat owner front responsibility type.,1.5899999999999999,32.40611887233068
7343,documentary,Colleen Jackson,Add most lose.,0.96,49.65641867052437
7344,scifi,James Foley PhD,Bring hour capital hold.,1.39,38.12524369901902
7345,scifi,Ashley Harding,Lot federal office guy maybe.,0.8999999999999999,51.82819136236511
7346,comedy,Evan Adams,Class light scientist piece.,2.0100000000000002,56.61830649732427
7347,romance,Mary Mack,Management lay billion show cost another what.,2.21,63.48332060635911
7348,romance,Jocelyn Jackson,Term notice result particularly think key determine.,2.5100000000000002,47.753157407845926
7349,documentary,Calvin Jackson,Research about after travel box make.,0.62,43.446192095970815
7350,comedy,James Andrews,Start baby recognize.,1.6199999999999999,43.2487169015094
7351,documentary,Susan Cole,Relationship body store.,0.4,49.89285947001964
7352,documentary,Mr. Brandon Richardson,Nor law television enter executive.,0.76,32.0297112063479
7353,scifi,Christine Nicholson,Budget there door after watch.,0.73,56.68366514366546
7354,scifi,April Schwartz,Six foreign movie view guy off fill.,0.48000000000000004,59.57335653687729
7355,comedy,Dennis Smith,Center rich crime their sense camera.,2.83,43.8882144196883
7356,scifi,Mallory Davis,Dinner else central activity environment policy.,2.7600000000000002,57.55856267529279
7357,comedy,Laura Neal,Law however huge debate artist.,1.67,51.48422484046219
7358,comedy,Jared Nelson,Rest book oil rock.,0.98,57.859109574199614
7359,documentary,Ryan Bell,Write dog stage follow different sister.,3.1300000000000003,35.197669296408264
7360,documentary,Kimberly Barton,Trial situation if soldier line professor receive.,1.8499999999999999,60.281313702552325
7361,romance,Robin David,Tree serious each surface their.,2.25,58.487223219908
7362,documentary,Paige Duncan,According clear successful music media own.,1.23,44.662476052913874
7363,romance,Michael Gonzalez DDS,Girl cost people form nation threat.,2.5900000000000003,67.70503660377508
7364,scifi,Brandon Hill,Scene continue officer not.,3.1900000000000004,44.64285613231758
7365,comedy,Ann Townsend,Support leg sense case.,2.23,60.757940111162085
7366,romance,Nancy Jones,Capital push finish candidate toward most concern nice.,1.24,78.64730829125669
7367,scifi,Brent Bolton,Player partner parent mouth popular.,1.24,48.66721782698369
7368,comedy,Robert Price,Sell clear see fire next stage he.,1.69,53.448957428181316
7369,comedy,Richard Reid,Friend keep arm along will tend arrive.,0.9199999999999999,55.93312125497821
7370,documentary,Nancy Mcknight,Serious guy turn end.,3.12,51.65552565332174
7371,comedy,Jared Schwartz,Thing general study risk.,0.44,45.691188030926064
7372,scifi,Andrew Diaz,Magazine because ask collection crime little.,0.7,51.755683097734654
7373,romance,Juan Franklin,Different method hundred tree.,2.43,62.549280615282576
7374,scifi,Drew Freeman,Number alone pass TV edge actually.,1.3299999999999998,53.476112698919046
7375,romance,Erica Montgomery,Part short open develop group second.,2.22,45.48014618808961
7376,documentary,Matthew Barker,Campaign run rate start play.,1.88,12.823169756277963
7377,documentary,Misty Sullivan,Ok else customer billion.,1.43,58.1230985714645
7378,scifi,John Anderson,Range second serve take huge.,0.6699999999999999,65.41880088615324
7379,romance,Melissa Higgins,Reality sign ground challenge everything fly.,2.77,42.84335933188983
7380,documentary,Carmen Schultz,Pay such skin live blood.,0.73,46.64617306357943
7381,comedy,Haley Stewart,Once cause break face free hold heavy.,0.39,46.74064207287897
7382,scifi,Monica Fox,Defense certainly describe offer partner each family.,3.02,29.790550659930645
7383,scifi,Lee Hernandez,Reality write evidence country.,3.08,52.32645549923587
7384,romance,Levi Fuller,Take rate meet usually may bank.,1.68,43.24441248140608
7385,romance,Mary Townsend,Both stand stand six cell because charge early.,0.52,52.64712118571828
7386,romance,Calvin Johnson,Box late school analysis mean.,0.5700000000000001,57.227391432868515
7387,romance,Mr. Carl Duarte,Goal say because cost.,2.1,45.214087088299316
7388,scifi,Justin Chase,Reduce so today wrong.,2.8000000000000003,54.30061953255062
7389,scifi,Rebecca Holland,Statement interesting experience else describe tonight prove.,0.35,40.06720967408465
7390,romance,Erin Thompson,Effort factor suddenly often ask situation.,0.95,40.516402164251275
7391,scifi,Carla Bates,Top local evening treatment course must.,0.74,57.481712516959604
7392,documentary,Terri Jones,Specific trouble history age wide total get.,1.02,56.28181407740274
7393,documentary,Heather Simmons,Tend religious all red.,1.8399999999999999,52.18196670322086
7394,comedy,Nancy Hughes,Director report kind.,0.9099999999999999,54.36272904244433
7395,scifi,Tracey Gonzalez,Cause other century money paper could.,2.5300000000000002,63.330579037539316
7396,scifi,Alicia Baker,Pattern process hospital material brother full defense.,2.6,57.81035038982672
7397,scifi,David Green,Trade student full open Democrat evening recent commercial.,0.77,34.402610777246174
7398,documentary,Kelly Jennings,Exist address find material.,2.45,64.32078296276148
7399,scifi,Michael Greer,Family gun suddenly no method.,1.3499999999999999,45.84425381843701
7400,comedy,Michael Thomas,Son six take finish several.,1.68,55.713426751088896
7401,scifi,Megan Clark,Long more investment ground and religious wait.,1.43,50.60640712059324
7402,comedy,Lisa Martin,Customer spring meeting economy source so where person.,2.96,46.2312918630003
7403,scifi,Jessica Romero,Toward office decide answer national oil peace.,2.58,47.93347077378103
7404,comedy,Jeffrey Reid,Along onto culture make idea firm.,3.04,40.67592476089983
7405,scifi,Carrie Wilson,Agreement local second mean class there girl series.,0.33,28.821634206914936
7406,documentary,Matthew Russell,Man team daughter thing seek majority.,2.6300000000000003,55.305028296054125
7407,documentary,Tyler Hughes,Threat rock miss fund investment.,1.23,50.050562242864686
7408,scifi,Adam Bell,Seat least time will sing would.,1.48,47.506553159726764
7409,romance,Melissa Nguyen,Film responsibility create recent despite only play.,1.52,29.23965827526591
7410,scifi,Anthony Ramirez,Stage smile carry main public.,3.0900000000000003,63.84873462287468
7411,documentary,David Sullivan,Significant economic avoid course effort.,1.16,49.08963650529856
7412,comedy,Dawn Young,Cultural run series call name help food.,1.3599999999999999,50.30650502209649
7413,scifi,Jamie Stone,Rise almost effect opportunity.,3.18,60.09941846114178
7414,romance,Katherine Stone,Sport whom be my sit require community.,1.21,54.04031216385535
7415,romance,Ashley Mcdonald,Work possible impact forward.,2.06,51.52966395249452
7416,documentary,Jamie White,Event walk choose least attention program determine against.,2.3200000000000003,55.78695777691338
7417,documentary,Dylan Hughes,Scene wonder change one note allow good.,1.78,43.30576918021263
7418,scifi,Tiffany Owen,Third teacher kind mother form party.,0.48000000000000004,59.65022612210164
7419,scifi,Brandon Jones,Politics town explain training gas.,1.3599999999999999,36.21222307480016
7420,comedy,Gary Morrison,These trouble should spend total order third.,1.8699999999999999,59.97992025066806
7421,comedy,Diane Thornton,Hotel west quickly wall poor scene.,1.95,32.75554244939612
7422,romance,Lisa Rodriguez,Expect employee by deep citizen smile spend.,2.74,52.13104597411797
7423,scifi,Lindsey Jones,Task man plant left personal them find.,0.5900000000000001,48.77614116838576
7424,romance,Luke Smith,Paper stay should set situation available.,2.8400000000000003,37.020398765558284
7425,romance,Linda Chavez,Key turn hour fly.,0.8800000000000001,43.50163446020006
7426,comedy,James Ramirez,Last movement too start tend rise expert.,2.09,40.535993381945374
7427,scifi,Ashley Patel,Enough PM position.,0.38,47.53042991098895
7428,documentary,David Price,Bit simple cultural public.,2.5300000000000002,43.23987008568232
7429,comedy,Christina Rodriguez,Like ten suddenly effort one talk.,2.6100000000000003,15.199401191582695
7430,romance,Kenneth Johnson,Claim total set.,1.5899999999999999,56.529011615188786
7431,documentary,Kara Wade,Tend meet picture inside billion tend.,2.74,52.72486295790041
7432,scifi,Crystal Crawford,Compare letter half compare.,1.47,38.660334720523366
7433,scifi,Jessica Harding,Which purpose involve music.,2.3000000000000003,55.10211732208997
7434,documentary,Hailey Gibson,Writer left question say wind follow.,3.12,55.931780812139024
7435,comedy,David Simmons,Fund five try fly eight relationship model which.,1.99,57.07774367552126
7436,comedy,Terri Richards,Forward base still fill news central.,1.14,59.561502581736434
7437,comedy,William Benitez,On believe purpose sure outside certain.,2.8000000000000003,53.62271871646144
7438,scifi,Paige Duarte,Compare each value near know statement approach.,2.6100000000000003,62.487995032559745
7439,documentary,Mr. Marvin White,Along pretty game from Mrs goal.,0.63,52.95244763596955
7440,romance,Maria Vasquez,Friend him deep condition.,1.3599999999999999,43.20546673461163
7441,scifi,Katrina Gross,Alone miss red direction color brother.,1.5899999999999999,46.22759587070635
7442,documentary,Jennifer Parrish,Break represent significant at seat without.,0.28,33.98024136143721
7443,comedy,Tanya Kirby,Responsibility support cell field.,1.95,37.84475442561258
7444,documentary,Diane Moore,Own somebody seven.,2.41,67.97875236729264
7445,romance,Raymond Anderson,Born however tend sing paper too.,2.1,53.455333541870466
7446,comedy,Barbara Wright,Brother this four who.,0.53,60.90822267911265
7447,romance,Austin Perry,Newspaper southern visit drug lose.,1.12,35.405206978033355
7448,documentary,Heather Peterson,Ago just involve any.,1.5799999999999998,47.15330897245173
7449,scifi,Francisco Gallegos,Environment degree more manage always.,0.49,64.29633276132427
7450,romance,Melanie Jones MD,Into tend visit civil executive later popular.,0.42000000000000004,54.69809414177446
7451,romance,Douglas Barrett,Language admit begin according.,2.6300000000000003,54.03480291728854
7452,documentary,Zachary Miller,Laugh why instead quickly community idea top.,2.19,43.775622916211915
7453,comedy,Natalie Fisher,Response interview nothing interview theory itself day product.,1.8,62.192304033932786
7454,comedy,Keith Dixon,Choose in difficult rest.,0.98,39.31153143329791
7455,romance,Nicole Meyer,Investment help here such.,2.2,61.34896672291989
7456,romance,Laura Kane,Building wall party machine choose rate.,2.4000000000000004,38.87157696780575
7457,scifi,Dylan Valentine,Rest while dog memory kid.,0.5700000000000001,36.62328683900634
7458,scifi,Lindsay Barnes,Add field watch reach himself.,2.7600000000000002,42.65262054399862
7459,scifi,Monique Mills,Treat onto stage month economy center house.,2.54,42.783078796075344
7460,romance,William Brown,May care forward pattern paper shake into.,2.0,36.39749436622827
7461,scifi,Joseph Welch,And someone able.,2.33,57.09172445528552
7462,scifi,Anthony Rojas,Church treatment federal sign change result home.,1.88,55.77657020466144
7463,romance,Mary George,Charge space production.,1.21,60.85136517960508
7464,scifi,Erika Reilly,Have executive inside friend since light.,0.61,51.15001281658885
7465,scifi,Jessica Bonilla,Nor writer fire key.,2.68,60.03159160167815
7466,comedy,Jason Ferguson,Me scientist cell debate indicate until wall.,2.5300000000000002,37.616930502469515
7467,romance,Jesse Vasquez,Quality player because necessary water still together.,0.25,49.197502080588016
7468,scifi,Kylie Day,Rich contain live there go hospital father.,3.14,50.070938043417605
7469,romance,Anthony Jenkins,Toward quality window imagine specific toward establish.,1.64,52.449192067479466
7470,documentary,Kristina Larson,Film beat environmental baby.,2.19,42.00796727502118
7471,romance,Molly Medina,Drive century act mention.,2.02,57.871188263461995
7472,romance,Jamie Mcfarland,Base pressure listen reach.,2.8400000000000003,49.76700617224107
7473,documentary,Beverly Ruiz,Spring despite trouble herself yourself yeah.,0.47000000000000003,43.90787880180216
7474,romance,Amanda Adams,He several physical computer like.,0.44,43.982999733608295
7475,comedy,Caleb Christensen,Quality wish result state draw bed.,1.88,52.416189470678006
7476,documentary,Peggy Haynes,Join near move pressure parent.,2.41,45.9416309854847
7477,comedy,Patricia Dunn,Including campaign finish movement middle.,2.98,38.362391049805325
7478,scifi,Susan Jones,Energy wall with all run anything especially.,2.93,56.9333400205294
7479,comedy,Kimberly Bailey,Measure forget season discover ten suggest.,3.1700000000000004,72.06032545896592
7480,romance,Susan Salazar MD,Decide within want north manager main bed reflect.,1.06,51.15320002738274
7481,comedy,Stacey Fisher,Upon pretty tax usually which ball window close.,2.2600000000000002,54.96087762735473
7482,comedy,Amanda Hill,Second subject total people.,0.31,55.242681134362265
7483,romance,Michael Taylor,Threat sign success still.,0.6799999999999999,44.60665186593728
7484,comedy,Jennifer Garrett,Past power production class.,1.03,64.32343312941481
7485,scifi,Olivia Martin,Great fact resource democratic time interest chance idea.,0.6699999999999999,53.28468500204244
7486,romance,Julian Miller,Rock not play improve.,2.18,40.35216527556843
7487,scifi,Courtney Ryan,Stay their sister present.,1.18,38.74855833956141
7488,documentary,Brandy Lee,Go thought party interesting.,1.12,59.52556731435206
7489,documentary,Alan Thornton,True current thought experience act.,0.48000000000000004,61.514540315275624
7490,documentary,Dakota Brady,Break plan within picture nothing.,3.1100000000000003,48.36770613874073
7491,documentary,Karen Thornton,Charge study organization mother.,3.02,51.0622513548687
7492,documentary,Patrick Garcia,Ground region shoulder.,1.88,41.75962618511903
7493,documentary,Thomas Rivas,Term budget candidate for.,1.68,39.78693720710484
7494,documentary,Victoria Hunt,Deal dog soldier record position store.,1.19,58.22974861009225
7495,romance,Jorge Sanchez,Value military sometimes next style.,1.75,57.63739565735075
7496,romance,Jeffrey Walker Jr.,Experience recently next.,0.65,63.797353092177104
7497,comedy,Daniel Allen,Build deep on different soon whole condition.,0.6799999999999999,50.936641986652745
7498,romance,Logan Francis,Building leader stand.,1.71,32.49733524732428
7499,romance,Timothy Hawkins,Be oil that hope place blood citizen.,1.41,46.279040867146826
7500,scifi,Anthony Hall,Down listen budget within month once west general.,1.3499999999999999,35.46888526843999
7501,comedy,Matthew Stanley,Series seat dog program service.,0.51,38.269768738260765
7502,documentary,Ruth Marshall,Travel huge policy yes color maintain.,1.3299999999999998,44.10872972916896
7503,documentary,Heather Spencer,Leave team ask goal big.,2.08,49.97081536921847
7504,documentary,Barbara Hayden,Family young win.,2.89,38.29117182253596
7505,romance,Jeffrey David,Pull pressure mention parent organization.,0.79,69.80496052421807
7506,documentary,Edward Adams,Strategy thought performance street thus charge everything.,1.42,44.69213210094163
7507,documentary,John Aguirre,Necessary education manage four you history law good.,0.78,44.18396413100508
7508,romance,Veronica Adams,Gas relationship book keep.,0.31,52.760180542547644
7509,comedy,Brandy Nguyen,White day trial morning fire student arrive.,3.16,49.86537995874244
7510,romance,Bryan Johnson,Water remember stage community able.,0.8400000000000001,68.95992507225375
7511,scifi,Damon Payne,Material end close society front economy.,0.29000000000000004,65.67077333619343
7512,scifi,Marc Russo,Industry home alone least onto lead past.,1.8599999999999999,55.40217722437477
7513,comedy,Laurie Henry,Sing increase learn office.,1.8599999999999999,51.587759856017
7514,romance,Jason Carter,Control life response least represent.,1.23,34.95816382972132
7515,scifi,Kathryn Campos,Behavior development since with itself item.,1.15,61.129173292909
7516,scifi,Lisa Smith,Employee society force debate.,1.2,59.26181545551578
7517,documentary,Jonathan Chapman,Everyone case under voice.,2.35,56.82975822332271
7518,comedy,James Graham,Democratic blue year modern.,1.4,36.68323971575869
7519,comedy,Heather Pearson,Likely music high seem society stay sure want.,2.5900000000000003,52.72009087445033
7520,scifi,Sean Anderson,National surface easy by growth.,0.99,76.30834425230806
7521,scifi,Jennifer Wilson,Letter prepare statement add.,2.81,43.219985206296904
7522,comedy,Justin White,Money career agreement.,1.16,58.21830800741262
7523,scifi,Kathleen Hill,Far condition policy.,1.79,70.16873140904275
7524,romance,John Turner,Discuss goal family worker.,2.02,55.03031044063469
7525,romance,Thomas Lopez,Partner rich business.,0.78,59.11767091605603
7526,documentary,Taylor Vaughn,Wind baby work than fund.,1.73,30.053899019042795
7527,documentary,Kelly Lee,So generation use then better morning audience beautiful.,2.29,47.361727508850066
7528,scifi,Sue Russell,Interest miss western something whole.,1.71,45.03084653906797
7529,scifi,Matthew Rodriguez,Man organization agree whatever alone just.,2.54,53.60244256476229
7530,romance,Robyn Lynn,Success watch born leg practice several.,3.14,58.86679845246925
7531,scifi,Kara Duncan,Almost like fund computer represent pay sit page.,1.23,44.43118386584007
7532,comedy,Timothy Velez,Fine sport might case than.,1.56,48.468256227156225
7533,documentary,Alexandra Smith,Law factor here cultural community.,1.38,45.6431807361963
7534,comedy,Lisa Tapia,Fast conference ground.,0.62,55.07981321452952
7535,documentary,Matthew Jones,Adult hold indicate radio already positive money.,0.98,55.27524905144446
7536,scifi,Joshua King,White head become him power the.,0.39,52.29879868174406
7537,comedy,Todd Chambers,He show size personal level next treatment.,2.04,52.37609199763324
7538,documentary,John Hall,Listen age box month executive.,2.7,58.81902854429039
7539,scifi,Robert Sims,Trouble road really pick another.,0.8500000000000001,62.42130371254239
7540,scifi,Mr. Brian Bradford PhD,Above such two people entire heavy camera.,0.46,37.94254795157426
7541,documentary,Lindsay Snyder,Worker study large we member number of.,2.75,52.182456526455006
7542,scifi,Amy Castillo,Enter drug development.,0.65,44.86208874376305
7543,scifi,Jeremy Chan,Form realize daughter analysis oil out happy.,0.36,66.91745637774488
7544,documentary,Matthew Grant,Born staff claim bit energy exactly little.,1.21,56.88818019069024
7545,romance,Gail Bush,Their only serve look necessary.,0.61,43.72646799055281
7546,romance,Diamond Garcia,For region structure.,2.7,48.45717403719367
7547,comedy,Katie Carter,Part clear coach suffer sister energy participant.,0.71,40.42183165470515
7548,documentary,Angela Lee,Bad future simple hot political.,0.47000000000000003,53.4688105935536
7549,comedy,Caitlyn Molina,Reflect example side wait several current.,2.31,62.57130946696372
7550,scifi,Lisa Warner,Person everything population across he.,1.44,57.71747202910943
7551,scifi,Jacqueline Dorsey,After build action into seven president.,2.27,48.18885603453274
7552,documentary,Nathan Mendez,Way suddenly former suddenly trade outside.,2.4400000000000004,62.01526327085907
7553,scifi,Madison Byrd,Line event positive.,0.5900000000000001,44.44530639929389
7554,scifi,Christopher Morales,Son far loss be begin.,1.88,55.507245001175775
7555,documentary,Douglas Pena,Eye sometimes join above power everyone movement.,2.64,38.808629816354916
7556,romance,Anthony Bell,Her blood loss manage.,2.6500000000000004,53.21618414879226
7557,comedy,Jason Haney,Ok want her early edge wish score.,2.85,48.337453818687145
7558,scifi,Charles Glover,Fly my those film.,1.63,56.88868405630667
7559,comedy,Robert Kelly,Through improve natural its.,0.79,28.05752106632161
7560,scifi,Matthew Hernandez,Pressure day happy what.,1.8,33.90801338877959
7561,romance,Emily Macdonald,Sometimes question common before suffer.,2.12,57.359294963541096
7562,comedy,Jessica Smith,Reach according see happen.,0.8400000000000001,39.4772328552948
7563,documentary,Gwendolyn Carney,Exist different culture answer.,2.7,50.90348035087634
7564,documentary,Jennifer Blevins,Manager later change despite under firm.,1.15,42.2139790625576
7565,romance,Julie Lang,Animal happen fish fall.,2.68,53.409431391431376
7566,romance,Brandi Dyer,Building charge respond make interesting war threat.,1.3599999999999999,37.141654503486365
7567,scifi,Jeanette Hardin,Price its fast case service.,2.3000000000000003,43.544276377183614
7568,scifi,Kristin Rivas,Fish to investment today simple.,1.65,48.13896493657753
7569,romance,Dustin Whitehead,Large memory build issue reach.,1.8399999999999999,43.71467433778783
7570,documentary,Oscar Brown,Me nothing author garden any office choose.,1.48,49.30296612740338
7571,romance,Cynthia Santos,Fine however writer speech both activity attack area.,1.6199999999999999,69.15129354945913
7572,scifi,Jeremy Simpson Jr.,Central three culture second note television amount.,1.24,37.361321583469994
7573,documentary,John Hamilton,About friend consumer realize just week fire popular.,0.8400000000000001,65.59377209620338
7574,romance,Mary Murphy,Already film life million.,0.39,57.05510054065218
7575,romance,Paul Summers,All take north think network idea ask.,1.25,60.03698137523674
7576,romance,Julie Miller,Age both interest.,2.39,48.79170135260888
7577,scifi,Anthony Duncan,Tell value like.,1.91,46.296401715247185
7578,documentary,Mary Evans,Everything note their gas.,2.8400000000000003,41.97071463908644
7579,comedy,Mr. Don Hill,Yet everything situation general them miss.,0.48000000000000004,47.73406753132961
7580,comedy,Marissa Jackson,Security clearly song window.,1.04,46.02096410082321
7581,documentary,Ashley Williams,Resource network himself whether enjoy.,0.74,60.682777300059655
7582,romance,Holly Kane,Several sing staff law home.,0.5,59.155496069389805
7583,scifi,James Walsh,Sort member feel want worry a bad community.,0.55,39.85282057751335
7584,documentary,Robert Robinson,Often senior born since.,2.0,71.58468384356928
7585,documentary,Traci Byrd,Want travel city during room heart fine.,1.47,63.690235191367925
7586,comedy,John Thomas,Just build movement current remain loss take simple.,1.77,36.498359050344014
7587,comedy,Christopher Davis,Fire tonight word travel sometimes claim.,1.94,58.31741387154338
7588,romance,Jerry Nguyen,Behavior technology man real put.,0.8899999999999999,51.7422911146596
7589,documentary,Melissa Walsh,Nor husband happy organization total third increase.,0.97,29.39821866152794
7590,scifi,Diane Baird,Model good up defense study.,2.62,68.26408339863377
7591,scifi,Rebecca Hernandez,Most own trip indeed system break house.,0.38,33.320562698112994
7592,documentary,Zachary Barajas,Our left risk political politics image remember letter.,0.73,54.49789068541561
7593,scifi,Ashley Jackson,Material series eye word.,0.23,53.432862797860594
7594,comedy,Austin Rodriguez,Report financial feel.,3.04,44.99001447488648
7595,scifi,Megan Clark,Thousand government strong standard.,0.45,46.58936361065386
7596,comedy,Robert Kelly,Mr race deal new very own.,1.77,46.00751035092976
7597,scifi,Janet Padilla,Value behind truth upon anything.,1.72,47.86850232673715
7598,comedy,Mandy Cabrera,Move reality risk summer decision reveal.,1.49,53.91775115001631
7599,scifi,Victoria Dodson,Since heart no.,1.48,38.842512678965164
7600,comedy,Scott Welch,Piece race traditional kitchen positive same point.,1.43,54.30353357311256
7601,scifi,Kim Martin PhD,Specific up full music deal.,1.91,39.84613940510389
7602,comedy,Jennifer Hudson,President able address sit.,0.42000000000000004,56.98461158163779
7603,documentary,Kristin Burnett,Manager identify far.,2.89,51.257902182403086
7604,comedy,Wendy Tyler,Address security like.,1.14,45.52228195158012
7605,documentary,Chelsey Clark,Tax off add near do those.,2.49,56.766708418676146
7606,comedy,Zachary Jones,Eat worry attorney report model.,1.73,55.865452980135636
7607,romance,Jessica Miranda,Trouble others common son most himself member.,1.28,52.27641918042239
7608,documentary,Stephanie Hansen,Human drive way gas here.,2.52,44.35045328719318
7609,documentary,Patrick Brown,My write office reflect sound authority civil.,0.2,58.5966029895204
7610,documentary,Robert Nunez,Us notice picture southern goal from break.,0.9099999999999999,39.4003768580496
7611,scifi,Adam Johnson,Air father nice during.,1.17,47.09821475957286
7612,documentary,Samuel Mccoy,Professional final shoulder.,1.77,53.54621845092822
7613,documentary,David Martin,International after night himself operation room with.,2.22,40.66331795179735
7614,comedy,Ronald Walls,Hundred history sister high.,1.82,36.07998093281033
7615,romance,Jennifer Melendez,One professor pass idea.,1.23,62.19519984151204
7616,scifi,Jodi Thomas,Affect expect but agency speech.,0.33,56.53916519321818
7617,scifi,Ryan Cooke,President song station.,1.66,36.01184520835266
7618,romance,Adrian Obrien,Hard discuss politics kitchen none accept.,1.93,64.49422558398693
7619,comedy,Timothy Flores,Heavy standard debate just lawyer detail effort enjoy.,1.56,53.26732862247353
7620,documentary,Brittany Doyle,Night away couple government either edge rest.,1.49,60.81167080718973
7621,romance,Tanya Woods,As war answer husband economic.,1.8299999999999998,53.27911328144716
7622,scifi,Tommy Garrison,Beautiful course two cell pass.,1.6099999999999999,45.401185596089796
7623,comedy,Kristen Coleman,Tax safe south federal parent hold fund heart.,3.1,50.18817121380661
