film_id,genre,director_name,title,length,rating
5075,documentary,Shannon Knox,Evidence table consider color common pretty base.,0.97,55.048649260416205
5076,scifi,Scott Barton,Dinner establish also a two especially least see.,0.98,58.23364783384821
5077,comedy,Amber Crawford,Hour score record reality not teacher gun.,0.8700000000000001,49.70226513080705
5078,scifi,Mark Dyer,Better their forward investment.,0.72,45.00822644657935
5079,scifi,Robert Clark,Record two make minute win ever.,3.06,50.03282736744692
5080,comedy,Samantha Wiggins,Great can pattern eat enjoy open.,0.81,62.920958508165164
5081,comedy,Brenda Hensley,Hand operation both box forward.,0.74,47.87906254210969
5082,comedy,John Small,Less item best manager meet.,1.31,64.1205919455247
5083,comedy,Nicholas Baldwin,Change body explain seem suffer only spring.,2.3600000000000003,43.542529553235646
5084,romance,Elizabeth Walker,Itself executive letter case together employee newspaper.,2.2600000000000002,60.582691489050845
5085,scifi,Mrs. Linda Smith,Magazine pass record value age option doctor lead.,2.3800000000000003,40.84733182435928
5086,scifi,Christina Sandoval,Provide administration bad low risk capital.,0.29000000000000004,58.4899240065538
5087,romance,Jamie Bryant,Trip American soldier performance.,2.56,62.187064005400686
5088,comedy,Dawn Ingram,Gun arrive condition again such care.,3.0700000000000003,50.46572804925903
5089,romance,Jean Fields,Future education quickly both.,1.56,60.46026776579389
5090,comedy,Rachel Costa,Send whatever off often bit evening ever.,1.18,55.15045604599281
5091,romance,Tina Finley,Conference black year believe course.,0.45,61.75984587387693
5092,romance,Bobby Goodman,Reduce gas black town American.,1.38,56.623414302973075
5093,comedy,Patricia Allen,Less feel meeting friend under whether recently mind.,1.97,41.95909984182855
5094,scifi,Justin Hood,Heart of task spend nation each.,0.37,46.68456957420271
5095,romance,Curtis Perez,Everybody effort would bed.,0.9099999999999999,40.546644020519665
5096,documentary,Melinda Perez,Election choose after far myself.,0.21000000000000002,56.306030964292646
5097,romance,Melissa Jones,Him even base decade southern information.,2.5900000000000003,53.285805623072
5098,comedy,Ryan Lynch,Administration a hot gas marriage lay concern.,2.58,53.30064291177883
5099,documentary,Laura Sullivan,Him down exactly by product high assume.,1.24,48.130054646578955
5100,comedy,Connie Spencer,No thing perhaps fall whom TV safe.,2.27,59.09499516550672
5101,scifi,Christian Davis,Better avoid space goal.,0.9299999999999999,42.92296419977339
5102,scifi,Deborah Adkins,Room eight behind else yes.,0.6000000000000001,38.07118252202856
5103,scifi,Deborah Graham,Yet truth vote pretty.,2.15,60.43853556184874
5104,scifi,Kevin Martinez,Prevent whatever them think party.,2.85,57.31477897606269
5105,comedy,Patrick Hanna,Treatment enjoy strong theory lead rather end.,0.24000000000000002,39.41643715594908
5106,scifi,George Velasquez,If wind administration economic.,1.05,53.51857506891458
5107,comedy,Joseph Liu,National space small structure church use.,2.47,33.963774563167725
5108,documentary,Sharon Greer,Past research environment throughout will usually key.,1.15,41.58752405122658
5109,comedy,Joel Tucker,Gun fund cover trouble exactly.,2.9200000000000004,64.57542083083248
5110,documentary,Stephanie Green,However reduce open chair.,2.09,33.90002765422476
5111,documentary,Troy Sims,Daughter live office political.,2.96,58.260843283522256
5112,documentary,Rachel Ross,Stock without consumer TV fall require site month.,2.5900000000000003,58.773229352753624
5113,comedy,Miranda Irwin,Who foot form result part pick of.,1.46,71.07447041993339
5114,documentary,Bethany Mills,Nation station day dog only support all.,1.5999999999999999,48.526380878047874
5115,documentary,Gregory Harris,Add floor write participant factor view huge.,1.8299999999999998,43.40620140011737
5116,scifi,Kevin Anderson,Choice school else above focus might reflect.,1.4,41.27204017364041
5117,romance,Renee Miller,Bring leave sometimes major fight one prove.,3.04,56.77256771917067
5118,comedy,Sandra Christensen,As wrong expert should why build.,1.89,66.83442755123968
5119,scifi,Samuel Thompson,It take car turn policy main thought.,0.8899999999999999,46.690226007037865
5120,documentary,Johnny Hamilton,Myself life pull benefit.,0.42000000000000004,47.15783702257887
5121,scifi,Jessica Evans,Think strategy old color admit who ago.,0.27,44.90671669787457
5122,scifi,Allen Holloway,Certainly whose no task will course end.,2.6500000000000004,66.38148979457532
5123,romance,Alex Hayes,Memory great find teach production deal memory network.,1.06,45.814515226656525
5124,documentary,Jonathon Poole,Matter recent whose.,1.49,50.66208188862852
5125,comedy,Gregory Fernandez,Pay last adult stock mother more.,2.3200000000000003,46.50673591295369
5126,scifi,Samantha Keller,Increase north three several home others beyond.,0.56,52.94344941936909
5127,documentary,Samantha Jones,Really his feel on everything sea wife.,2.15,39.76291480753348
5128,scifi,Robert Gonzalez,Fund heavy better film spring anyone station.,2.85,48.243486859994924
5129,documentary,Heather Vance,Discuss oil truth suffer.,2.47,39.15898216128817
5130,comedy,David Heath,Suffer factor the attention.,0.32,51.283970625850905
5131,comedy,Beth Cardenas,Run staff bed either seem kid little speech.,1.26,43.00775869632378
5132,comedy,Jennifer Hall PhD,Within eat shoulder you much thank.,3.1,53.212223156703814
5133,documentary,Paige Wallace,Edge sister another.,0.44,52.84362523001816
5134,scifi,Jesse Taylor,Wonder investment late Mr team maybe middle.,1.07,54.03645740189286
5135,romance,Madison Kennedy,North amount head mouth meet.,0.45,48.3544183333594
5136,romance,William Sanchez,Response mean simple.,2.0500000000000003,38.553477576817926
5137,romance,Kirsten Schwartz,Word strategy indicate compare sister often.,3.1,44.83017293435463
5138,comedy,Kathryn Mcguire,Whole particularly argue argue morning poor customer animal.,1.79,52.59397181075861
5139,documentary,Paul Edwards,Significant prove right light would.,2.4400000000000004,57.84977053564606
5140,comedy,Deborah Mcguire,Enjoy free worry will improve.,1.28,43.23362052400646
5141,documentary,Monica Cantu,Own front indicate front whether process.,0.45,50.48550905640589
5142,documentary,Jessica Flowers,Writer successful fact real agree.,0.8800000000000001,51.1902996483899
5143,comedy,Patricia Manning,Develop available fill owner effort.,0.4,45.21087596310222
5144,comedy,Dana Cole,Reflect individual include.,2.48,63.08996904756775
5145,documentary,Leah Nelson,Have fish a chair happen author present.,2.5700000000000003,59.66473076370769
5146,documentary,Michael Smith,Will system once approach.,1.24,63.63355561352204
5147,scifi,Christopher Wilson,Spend full use maintain.,1.69,49.2795567350767
5148,comedy,Daniel Moore,Treatment force investment mean would beat bank election.,1.06,49.56154458533177
5149,scifi,Patrick Silva,Now suffer Democrat trip recent quality.,0.33,46.49602901931032
5150,comedy,Heather Barnes,Central week not something represent pattern cold.,3.04,53.99038973291286
5151,scifi,Ashley Sellers,Traditional small seem drive husband including protect culture.,0.55,43.93039368552786
5152,romance,Angela Garcia,Trial morning research.,1.06,49.86853711139099
5153,documentary,Donald Walker,Know drive sort.,0.37,61.209528319897856
5154,comedy,Michael Estrada,Enjoy address less keep network radio suddenly.,0.27,43.192378613969495
5155,scifi,Catherine Martinez,Voice include blue half.,1.05,60.039256106378915
5156,romance,Tina Park,Worker able billion us.,3.0500000000000003,52.22327715276567
5157,romance,Kelly Phillips,At owner over option since financial usually.,0.8200000000000001,59.779930580570465
5158,documentary,John Meyer,Physical positive tree board street she Mr.,1.7,54.258266977027645
5159,documentary,Mr. Theodore Lane Jr.,End read day against.,1.09,58.7517445790304
5160,documentary,Whitney Bowen,Road player most its somebody.,0.6000000000000001,62.57101094468959
5161,documentary,Brian Harper,Present particular evening space receive water.,0.65,39.410809634927745
5162,comedy,Chad Miller,Environmental tend meet owner buy.,0.4,60.01572401220349
5163,documentary,Shannon Moody,Defense relationship trial occur TV.,1.46,47.19567541076775
5164,scifi,Paul Hunt,Hotel image teacher.,1.9,37.697183237445365
5165,romance,Tonya Jackson,Take indicate moment election now.,2.29,44.93748090259051
5166,comedy,Melissa Johnson,Fight address able suggest authority sea road.,2.0100000000000002,37.146634878187115
5167,comedy,Karen Spencer,Can indeed energy allow school teacher my.,0.32,51.60458800763419
5168,scifi,Rebekah Buckley,Organization use cold free before often.,1.94,60.35913187831353
5169,comedy,Stephanie Porter MD,Relate himself alone physical great western him.,1.03,67.38879826443173
5170,documentary,Jennifer Garcia,Almost question country realize.,1.73,57.57631572060482
5171,romance,Timothy Lynn,Know edge evening.,1.2,32.65601953148549
5172,romance,Paul Buck,Effort wide still have.,2.06,43.77258630894471
5173,comedy,Francisco Garcia,He know deep among.,2.0100000000000002,50.94851990611508
5174,romance,Amber Bailey,Probably as everybody information safe.,1.3299999999999998,52.302943251714154
5175,documentary,Karla White,Appear once apply professional.,1.8599999999999999,55.39870876528144
5176,scifi,Cynthia Lyons,Skin wish central manager central region.,3.14,53.39516989240278
5177,documentary,Amanda Gonzales,Important learn cultural water compare part.,0.34,50.87754038379466
5178,romance,Jeremy Brown MD,Question rather room network media detail decide.,1.99,43.49796393046424
5179,romance,John Clark,Citizen oil world first husband throughout building.,0.63,66.09742438790096
5180,documentary,Dawn Barber,Eye ever play collection.,3.04,56.17858978061933
5181,romance,Corey Elliott,Idea list at goal food law subject.,0.22,25.493260240092994
5182,comedy,Troy Edwards,Central memory this structure society now voice.,1.79,63.70707262887267
5183,romance,Sara Hart,Green feel adult argue far ready simply.,1.18,61.84438843674526
5184,comedy,Sarah Smith,Development save season real.,1.08,54.92158076817984
5185,comedy,Gregory Walton,Section training partner skill threat family with.,2.0300000000000002,46.113873155725656
5186,documentary,Gina Brown,Certainly put common put.,0.34,36.99555759003385
5187,documentary,Jesse Curtis,Will true because every.,1.09,52.70548070767808
5188,scifi,Anthony Holmes,Set perhaps sure opportunity father program shoulder.,1.3299999999999998,29.86751049622503
5189,comedy,Billy Vazquez,Believe new might ten wall firm near.,1.79,62.10913118626813
5190,documentary,Kimberly Jackson,Question protect major reduce.,0.76,48.05639208108022
5191,comedy,Denise Ramirez,Another get ever effort.,2.62,59.57533637118761
5192,comedy,Maria Landry,Mission citizen person drug view kind.,1.15,56.20397633019555
5193,scifi,Mark Martin,Base close former cut reflect.,1.8599999999999999,41.38841958472355
5194,scifi,Anthony Walters,Wish work but eye drug cover.,2.39,52.162506314400595
5195,scifi,Julie Allen,Idea west I body cold officer anything.,2.93,53.91517247766212
5196,scifi,Troy Wheeler,Four artist site compare fall.,2.97,68.66282905281838
5197,scifi,Andrea Torres,Western arm each produce.,2.7600000000000002,60.8162486102693
5198,romance,Anna Mills,What class such.,0.42000000000000004,45.044598720774104
5199,comedy,Cynthia Dixon,Situation hospital tough lose cup.,1.19,38.502087486771
5200,comedy,Trevor Lang,Market strategy reality send them walk.,0.31,39.749436529565685
5201,scifi,David Ingram,No anyone try wish.,1.22,68.09146219859679
5202,scifi,Tristan Washington,Board exist pull dream trip.,2.6300000000000003,46.94210788168723
5203,romance,Brandy Woods,Yeah less outside style computer culture around pick.,0.46,39.98715297291618
5204,documentary,Megan Keith,Five paper stage in floor.,0.45,58.40683677931855
5205,documentary,Charles Caldwell,Participant Mrs ten event.,2.8400000000000003,69.12167247765453
5206,romance,Benjamin Ramirez,Grow loss southern recent road will.,2.64,54.489798727355264
5207,documentary,Renee Peterson,Left and remember talk.,1.22,42.12378784957214
5208,romance,Mary Griffin,Fight within management can not so very.,0.73,41.74439657575333
5209,documentary,Anthony Lee,Truth recognize represent contain training hair apply.,3.18,49.42790554548467
5210,documentary,Michael Lyons,Risk lead degree everything case like south.,2.95,34.61080027765127
5211,documentary,Katie Powers,Interview human course education public.,2.33,41.420083177549415
5212,documentary,Margaret Moran,Central create sound out though.,0.64,57.03375636843418
5213,romance,John Thomas,Process main dream free finally knowledge put.,1.15,67.51405355509401
5214,documentary,Robert Oliver,Production lose claim light.,1.46,55.5340874184872
5215,romance,Thomas Perez,Table test music.,1.51,42.88011657937873
5216,scifi,Jason Ayala,Guess able local.,0.75,44.20572858833855
5217,documentary,Cynthia Cole,Writer short reduce whether coach animal administration.,2.79,54.961033779778234
5218,comedy,Susan Navarro,Cell behind hot apply list.,1.01,47.21658876927148
5219,documentary,Jessica Green,Yes need through morning into class.,1.17,25.995158541019933
5220,scifi,Tiffany Sosa,Work for could example reduce law.,2.4200000000000004,52.71114168109307
5221,comedy,Kathleen Edwards,Teach method many leave.,3.1700000000000004,56.23421932644687
5222,documentary,Kelly Fisher,Nothing join learn end.,0.81,46.327977878951685
5223,comedy,Adam Ross,Indeed late call move list.,1.9,57.26143260723016
5224,romance,Jessica Reynolds,Citizen maybe language suddenly quite standard increase.,0.44,60.620044254740804
5225,romance,Michael Dunn,Minute modern realize new even travel.,2.5100000000000002,66.3543818428497
5226,romance,Janet Thomas,Service last among suffer huge.,2.8800000000000003,45.17717693385117
5227,scifi,Kristen Burton,Successful possible level our compare.,0.65,48.30834548196525
5228,romance,Aaron Jackson,He thousand great could system air.,0.72,49.25990439103283
5229,comedy,Keith Price,Cell owner fear page matter police Mr.,2.58,61.33470620813852
5230,documentary,Erin Schmidt,Tax pass they skin air rise call.,0.8200000000000001,56.63888930147679
5231,comedy,Nicholas Kelly DDS,Enter reflect other practice argue stand.,1.17,51.75851240455188
5232,romance,Tina Rodgers,Agree kitchen popular central book.,0.66,47.845655451943145
5233,scifi,Grace Soto,City simple manager stand.,1.53,58.59471608399464
5234,documentary,Marie Evans,Debate impact whom remain discover field.,2.11,60.71617377214487
5235,comedy,Jeffrey Williams,Finally a present capital these.,3.04,54.60415522723734
5236,documentary,Patricia Reynolds,Agency coach represent deal.,1.54,42.7490048746716
5237,scifi,Ryan Hanson,Action around fine us check finish.,0.8700000000000001,57.31353199038053
5238,romance,Robert Gamble,Within receive today magazine poor action their.,0.9099999999999999,53.68199242735739
5239,comedy,Albert Price,Society ground break behind movement cup score eight.,0.44,39.19972277001511
5240,romance,Kimberly Smith,Bring through writer.,2.75,42.874565289848185
5241,scifi,Matthew Fox,Scientist road prove who parent look land.,1.2,35.98548339454839
5242,scifi,Kimberly Moody,Can positive black many majority economy describe.,1.73,55.76102946800392
5243,comedy,Brian Chapman,Look high health western window most we.,3.0100000000000002,45.62904102143408
5244,romance,Mrs. Meghan Washington,Single start general product along this.,1.56,49.92601472477386
5245,scifi,Joseph Miller,Player poor see.,2.41,50.7367708897712
5246,romance,Joshua Simmons,Republican design choice.,1.4,46.33297448202467
5247,documentary,Andre Morris,Popular establish to similar put.,1.41,54.466210781180706
5248,scifi,Chloe Booth,Opportunity police participant adult election financial.,1.75,49.74961213390204
5249,scifi,Elizabeth Stewart,Three part over from agreement game compare.,0.71,59.92031254156435
5250,scifi,Gary Martinez,Stand into here military.,0.33,37.39048982162736
5251,documentary,Aaron Oconnor,Again deal official debate heavy.,1.68,50.12266794261299
5252,documentary,Jennifer Paul,Under sell arm book.,2.3600000000000003,61.89043271617311
5253,romance,Angela Wilson,Cup south prove catch open.,2.3000000000000003,55.09232028184102
5254,documentary,Stephanie Vang,Miss grow defense everything provide affect meet.,1.0,52.120167502159035
5255,comedy,Oscar Edwards,Whose production respond window ever.,1.1300000000000001,57.90582800864584
5256,documentary,Joan Ford,Side somebody difficult almost.,1.0,53.79656870534276
5257,romance,Jordan White,Site so activity hear ball should his entire.,2.0,80.77873083379131
5258,romance,Anthony Black,Who as business national share.,1.76,52.86942743777474
5259,scifi,Jacqueline Jackson,Land accept whose water name weight.,2.8600000000000003,61.95803805715079
5260,scifi,Jennifer Stewart DDS,To participant hour interest contain teach our.,1.77,48.977356553692296
5261,comedy,Tina Austin,Learn everybody parent word modern cup.,1.05,57.16540722067751
5262,scifi,Neil Allen,Ten appear no interview too.,0.39,42.747669757484736
5263,romance,Jessica Burns,Run will beat important herself media.,0.65,57.23462127786571
5264,scifi,Marcus Leach,How easy keep political newspaper current.,0.36,38.979732288841326
5265,comedy,Joshua Robertson,Place eight recent science interesting.,1.24,52.08219067067972
5266,comedy,Benjamin Johnson,Nearly between collection bar reflect.,1.48,69.13242028846861
5267,scifi,Jamie Bell,Audience together million.,2.2600000000000002,51.892015355577186
5268,documentary,Frank Douglas,Back fish population.,1.8599999999999999,59.65080325590465
5269,romance,Joyce Best,Party run against nice ever.,2.89,44.62280595506435
5270,scifi,Scott Hood,Throw federal medical seek.,1.8299999999999998,42.243340667677465
5271,documentary,William Phillips,Finish reason less every center collection.,2.17,43.325579252936045
5272,comedy,Christine Key,Hot civil size number or.,2.06,36.038854027185025
5273,romance,Peggy Lee,Near maintain wrong brother.,2.16,35.56542045223548
5274,scifi,Barbara Ochoa,Politics then administration break wish assume.,0.42000000000000004,51.27896954538171
5275,comedy,Robin Smith,Glass not fill theory budget.,1.44,40.107695160860416
5276,documentary,Phillip Mann,Draw tell season phone.,1.11,51.594543290775846
5277,romance,Anthony Marshall,Difference degree husband.,2.48,39.68847488193899
5278,scifi,Kathy Stone,And police perhaps military bar billion himself.,2.97,46.92266512565511
5279,comedy,James Robinson,Close thousand pull long radio.,2.46,58.50362352370306
5280,romance,Christopher Chambers,Senior land green analysis cover.,0.52,71.15547412259133
5281,comedy,Michael Kramer,Smile reduce sister knowledge information stock who.,1.07,53.06017694787608
5282,romance,Bryan Lucero,Firm catch seem different artist everyone.,0.8300000000000001,38.53953063258588
5283,scifi,Anthony Murphy,Far control assume year office you.,1.29,31.37856274663647
5284,romance,Mr. Michael Myers,Successful production despite hundred ago.,1.99,52.21136943576223
5285,documentary,Amy Thompson,Necessary professional sit three.,0.26,55.85908287408145
5286,documentary,Whitney Williamson,Environment war level when project drug Congress.,0.9099999999999999,36.511942872883495
5287,scifi,John Barrett,Walk whole card fall moment.,1.51,58.05663780006507
5288,scifi,Stephen Skinner,Guess effort teacher cell consumer.,2.97,52.34338724564488
5289,comedy,Cynthia Mcdaniel,Involve history adult feeling center.,1.8399999999999999,47.5177255576122
5290,documentary,Dawn Medina,Air environment boy probably once nothing police.,1.77,48.80208123053582
5291,scifi,William Mahoney,Remember we create or respond off hair.,0.79,35.933218646501935
5292,romance,Hannah Lewis,Home election attention plan former hold energy scientist.,2.54,41.37038586760833
5293,romance,Jessica Perry,Good realize leave political prepare.,2.17,40.368626506225034
5294,comedy,Taylor Marshall,Huge person contain American culture ball meet.,0.6699999999999999,39.57841244006417
5295,documentary,Ashley Reynolds,Identify nothing reach suffer pay American eye south.,0.7,58.83480709625253
5296,romance,Anthony Moyer,Understand allow enough speech.,1.11,42.234806208604304
5297,comedy,Victoria Francis,Degree phone more.,2.22,44.99565679296985
5298,comedy,Jessica Duncan,Team more return show seek about yes.,0.30000000000000004,55.370141816960725
5299,documentary,Robert Flores,Yet member concern real read fire easy first.,1.16,38.881678137365725
5300,scifi,Aaron Hurley,South include under mouth bar for system.,2.45,53.26247407416716
5301,scifi,Ashley Espinoza,Growth huge health success.,1.12,69.04639909823965
5302,scifi,Elizabeth Parks,Upon arm less scene him real table.,0.79,45.81901688633044
5303,scifi,Aaron Francis MD,Turn last billion avoid rest pattern table weight.,2.4200000000000004,53.526607373661335
5304,scifi,Dr. Stacie Mcmahon,Interesting staff run.,2.6500000000000004,29.76975438167446
5305,scifi,Carlos Thomas,Do public material bring contain year pressure.,1.53,57.37340036183399
5306,comedy,Nicholas Schultz,Anything concern common democratic represent difficult.,2.37,57.85836682578737
5307,scifi,Jorge Hayes,Catch believe there find.,2.5500000000000003,50.74494726666962
5308,comedy,Hayden Pratt,News in she involve allow foreign.,3.18,47.55762827224516
5309,comedy,Rhonda Carter,Join religious speak hit strategy speech success.,1.5799999999999998,29.40451869785838
5310,documentary,Sarah Davies,Figure lot contain tell.,1.69,34.187994154343514
5311,romance,Robert Hughes,World young plan draw.,0.30000000000000004,45.270818729271824
5312,romance,Luis Hansen,Drug magazine whole another defense.,3.0100000000000002,60.18780767116722
5313,scifi,Sarah White,Under begin one act finish last.,3.1500000000000004,66.02112301272473
5314,romance,Kristina Wagner,Change buy back past threat.,0.28,47.320502943259505
5315,scifi,Dustin Robertson,According measure important cell always represent campaign.,1.92,53.053871129075596
5316,comedy,Tyler Knox,Democrat director child site could.,2.29,50.39864835892466
5317,romance,Rebekah Lawson,Seven she option thing.,1.8699999999999999,48.83987948521882
5318,romance,Francis Caldwell,Open nature upon value purpose around.,0.5700000000000001,36.0401351862284
5319,scifi,Sara Brown,Administration space green direction per.,2.5300000000000002,69.31766387511591
5320,documentary,Heather Beck,Admit school religious technology.,1.67,41.140608519582564
5321,documentary,Martin Knight,Degree couple although.,1.01,54.245414561945154
5322,scifi,Sarah Wagner,Share simply amount thing thus still situation.,2.22,37.255823338092384
5323,scifi,Megan Contreras,Financial space middle someone my TV break arm.,1.78,49.325181259888176
5324,romance,Jason Nicholson,Third behavior when east response fund field.,2.3600000000000003,58.79292326653794
5325,comedy,Glenda Williams,Through against store loss.,2.96,37.69480859292898
5326,scifi,Robert Andrade,Partner likely card strong customer oil bag while.,3.04,33.97151688022965
5327,romance,Angela Harrison,Mr popular listen stand research.,0.72,63.85006950900211
5328,documentary,Brenda Carter,South study society result fire maintain trip week.,3.0900000000000003,38.087041139711644
5329,documentary,Kevin Clark,Something not treatment bank.,2.18,40.2897313724786
5330,comedy,Steven Jones,Every treatment trip follow reach spring next star.,2.0500000000000003,40.673153530704695
5331,comedy,Scott Murillo,Choose generation source step partner.,1.3399999999999999,46.46575559066151
5332,comedy,Nicole Fox,Bad own all goal require.,1.28,62.104600404385174
5333,comedy,Margaret Robinson,Cell traditional quite anyone music last focus.,2.1,43.66987734582358
5334,comedy,Howard Martinez,Try hundred at continue chair finally experience.,2.91,47.887895183241056
5335,documentary,Michael Barnes,Best store arrive difference on address short.,2.11,38.75716799663725
5336,romance,Jessica Ball,Quickly wish whole information instead event project.,1.78,67.75892787499288
5337,documentary,Tiffany Mays,Project behind meet every resource office care.,2.22,61.95357408389596
5338,scifi,Charles Allen,Why stand understand practice decide.,2.0500000000000003,47.61843514895862
5339,documentary,Patrick Torres,Serve along which local easy.,2.21,43.861382834388564
5340,comedy,James Smith,Expert so yeah city then sometimes read.,2.96,57.694031566633456
5341,documentary,Kevin Gomez,American stage do best game share realize.,1.44,43.83964856444916
5342,scifi,Patrick Nelson,Level others PM world as thought.,1.93,34.59438560233386
5343,comedy,Joshua Salas,Try crime action ago best.,2.29,58.30829074802602
5344,scifi,Denise Hughes,Because those on yard least.,2.5,53.93851478305325
5345,documentary,James Hall,Air of though quality sit plant.,2.71,61.27024517426135
5346,romance,Harry Lewis,Election front believe various record gas.,2.96,45.063568535194406
5347,comedy,Patrick Carter,Head part develop success kitchen else wife.,3.12,63.40115719467765
5348,romance,Christopher Finley,Interview support employee whom force list social beat.,2.96,52.49739522423218
5349,documentary,Raymond Jimenez,Contain significant level fall through special think.,2.75,44.565918113144875
5350,romance,Robert Ross,Not message school him common despite recently.,0.6799999999999999,42.873167516219034
5351,comedy,Erin Chang,Pattern operation product increase add south wind.,1.06,36.130588078772874
5352,documentary,Seth Floyd,Western trip prepare dinner.,3.0900000000000003,56.75953566022159
5353,documentary,Darren Taylor,Lawyer man American serve themselves.,1.05,64.06557204115387
5354,scifi,Martin Blackburn,Mind blue admit machine art car.,0.5700000000000001,42.90609510411544
5355,documentary,Gerald Scott,Team billion those arm fast three activity.,2.12,38.2402486059301
