film_id,genre,director_name,title,length,rating
2546,comedy,Joseph Blackwell,Song think tax adult ten suddenly sell.,2.2600000000000002,48.6174168840291
2547,documentary,Justin Lambert,Course respond best change something and.,2.95,52.208226172309665
2548,scifi,Whitney Jackson,Rest notice half happen rock.,1.92,66.61444339237778
2549,scifi,Kathy Hale,Machine glass coach.,0.5,50.668663530460414
2550,scifi,Michelle King,Trouble person effort tonight remain such.,3.16,43.59522741558643
2551,romance,Katherine Blackwell,Second like protect season.,1.66,38.48236987126837
2552,scifi,Joshua Hunt,Nearly article another thus professor growth.,0.39,50.75148757229596
2553,documentary,Amanda Bowen,Deal pay three president understand.,2.89,29.624654902055134
2554,romance,Scott Gomez,Process hold law able early.,0.8400000000000001,58.92726866900048
2555,scifi,Maurice Frederick,Analysis large probably you allow show message.,1.44,42.36516086140064
2556,romance,Erin Collins,Hot card scientist call claim include yes.,1.47,62.10567281482073
2557,scifi,Sean Cooke,Front care sport receive such guy else lot.,2.8400000000000003,36.90200451674994
2558,scifi,Danny Wilson,Recognize difficult decision teacher time challenge recently.,0.8300000000000001,52.28675142639296
2559,comedy,James Mendoza,Crime we paper art wrong sell business.,3.02,53.99768671945013
2560,scifi,Sean Davila,Hard sure next number.,3.1700000000000004,55.605612269561874
2561,romance,Maria Taylor,Big best prepare smile lead.,0.8999999999999999,75.79718956309812
2562,scifi,Amanda Weeks,Green only in however bank point.,0.47000000000000003,54.25583356610664
2563,scifi,Matthew Jimenez,Across area air involve add any seat.,0.32,36.80522833816704
2564,comedy,Curtis Trujillo,And fight follow ok.,2.48,69.22253558224304
2565,scifi,Jonathan Soto,Cultural item call president market catch girl.,2.21,51.424893044635105
2566,romance,Lori Roberts,Tell continue individual only result difficult.,0.8,44.131948836764124
2567,comedy,Deborah Kline,Sound use deep huge human.,1.3699999999999999,42.56921687319532
2568,scifi,Melissa Gaines,Officer let fall create ten party each.,3.18,54.45460943597891
2569,romance,Edward Gordon,Road way capital role treatment shoulder newspaper.,1.68,26.91107026251173
2570,documentary,April Davies,Long responsibility certainly all.,2.3800000000000003,42.47487848714901
2571,romance,Holly Spence,Participant image political positive product.,0.73,41.64793290670492
2572,comedy,Cody Sanchez,White those pretty lot.,2.2600000000000002,52.58208197939247
2573,scifi,Hector Jackson,One responsibility billion soon environment treat.,0.35,48.443823028170286
2574,documentary,Keith Evans,Why prevent east director.,0.34,50.46447419214649
2575,scifi,Michael Johnson,Market father senior different long water.,2.08,40.475974587406085
2576,scifi,Mr. Christopher Pena,Card prevent herself brother woman add.,2.6300000000000003,33.07320914172351
2577,documentary,Dustin Allen,Where after product system.,3.04,51.80474416712265
2578,comedy,Jillian Pace,Hit suggest who other day politics start.,0.74,55.54071629187737
2579,documentary,Jessica Carroll,Think population bill follow radio open teach unit.,2.58,66.48754839993255
2580,romance,Brett Zuniga,And guy option tax another.,2.81,58.006512758083986
2581,comedy,Jennifer Jones,Low audience here less candidate.,1.04,45.41505987787321
2582,romance,Kayla Jenkins,Argue civil bank chair prepare reflect.,0.36,67.89700106319047
2583,documentary,Amy Potter,Become energy age central water.,0.33,37.40866748598066
2584,romance,Sandy Boyd,Full force ball apply friend hard.,0.69,56.921879593171
2585,documentary,Aaron Bailey,Quite these crime me.,2.06,58.58393277314483
2586,documentary,Andrew Nunez,Book need world modern assume responsibility cup PM.,1.25,38.941971041436375
2587,documentary,Jon Garza,Cup cell song benefit health major career agreement.,1.0,43.6646474420994
2588,comedy,Monica Jones,Address war art tough.,2.15,44.4835347590314
2589,scifi,Brent Davis,Treatment leader stay maintain.,0.43000000000000005,49.36573140111506
2590,comedy,Kristen Young,Out laugh create control building mother activity.,2.87,56.96701799780601
2591,comedy,Jaclyn Owens,Half after go top piece forget.,2.0300000000000002,53.26024427407788
2592,romance,Matthew Lewis,Policy there middle affect party.,1.92,53.917449274162855
2593,documentary,Valerie Campos,Human training subject security.,1.78,64.45221799915099
2594,comedy,Isaac Diaz,Every back community piece suddenly.,0.23,46.24992849356598
2595,comedy,Beth Reynolds,Science attention point word within.,3.1700000000000004,45.0729693649992
2596,scifi,Tina Perry,Give project even participant.,2.12,58.117628559310795
2597,documentary,Stephanie Sullivan,Big sing work have music need.,1.81,60.262918271954845
2598,comedy,Samuel Bowers,Hour meet do middle build feeling.,0.30000000000000004,29.602449620043643
2599,comedy,Brian Reyes,Tax necessary stay camera.,2.3600000000000003,60.784375307121834
2600,comedy,Bonnie Evans,Soldier us discuss success forward condition wrong.,2.5300000000000002,53.92437279133235
2601,documentary,James Cunningham,Material land high song leader kind coach.,2.64,53.05860169670422
2602,comedy,Seth Galvan,News bring federal several.,1.25,40.338218506532584
2603,documentary,Diane Johnson,Four tough action last fish despite.,3.1500000000000004,57.75050415834766
2604,documentary,Michael Ramos,Generation fund all quality.,3.1500000000000004,66.9874180144082
2605,romance,Seth Allen,Assume experience approach history hair approach.,1.41,38.56068170093852
2606,romance,Jessica Delacruz,Material eight matter develop along say.,2.4000000000000004,37.050806123802744
2607,documentary,Bobby Oconnor,Remember mother citizen base.,0.43000000000000005,49.843322650950604
2608,scifi,Stephen Reyes,Bar might language respond.,1.3,49.52707102523916
2609,romance,Melissa Arnold,Capital soldier whose figure lay break.,1.19,44.69671028975259
2610,scifi,Sarah Lopez,Community without little both sometimes easy you.,2.18,45.60710122094196
2611,comedy,Kevin Peterson,Leg owner along simple.,1.76,57.32190816021221
2612,scifi,Nicole Smith,Stop term determine economic traditional almost leader parent.,2.75,70.35004215541454
2613,romance,Nicholas Andrade III,Worry miss rule develop especially standard.,1.94,43.033523636927264
2614,scifi,Mary Leon,You course first dark far.,2.41,32.296098575781826
2615,scifi,Robert Armstrong,Attention your total mouth learn wife too.,2.1,57.990968699904116
2616,scifi,Scott Robertson,Process choice political involve down safe trouble.,0.27,35.2919410963371
2617,romance,Richard Cochran,Into base response medical past.,1.25,49.94873713966353
2618,documentary,James Anderson,Year despite certain under dinner second decide interest.,2.5300000000000002,55.412912266095674
2619,scifi,Heather Copeland,Car various support for art store Mrs.,1.17,43.71446796471547
2620,romance,Jacob Owens,Detail land tax sell beyond especially pay.,1.14,46.18615770124557
2621,comedy,Laura Bridges,During hundred war little.,2.0300000000000002,68.45229285667165
2622,romance,Troy Myers,Cost ahead ago head Democrat my though reach.,1.16,68.9195992255145
2623,comedy,Michelle Murray,Down such direction authority run reflect who.,2.11,54.65255818334575
2624,documentary,Daniel Ross,Throw lead per detail.,1.79,42.596637603365544
2625,scifi,Amanda Carpenter,Major source national argue compare teach sound tax.,2.9200000000000004,43.85446066405238
2626,comedy,Terri Glenn,Model ground hair old not.,0.45,47.24743462606254
2627,comedy,Carolyn Wilson,Beyond need hotel believe.,0.56,48.186098735482126
2628,documentary,Virginia Lawrence,Everybody one suggest sometimes meet remember its.,2.71,34.74365802130283
2629,comedy,Kyle Mann,Fire democratic operation region two off week.,0.5700000000000001,59.480435993947054
2630,comedy,Connie Washington,Health control common car.,1.07,40.25561462291111
2631,documentary,Crystal Hood,Add board couple himself white lawyer where.,2.6700000000000004,46.55741078093923
2632,scifi,Sheila Lawson,Herself which film check today thus.,2.46,43.096566545073074
2633,comedy,Brenda Strickland,Use age dark law.,1.8399999999999999,58.682531695248535
2634,documentary,Brenda Smith,Behind difference education check different glass.,0.98,37.68225117769397
2635,documentary,Rachel Smith,Office writer girl.,0.32,41.53995276647859
2636,romance,Troy Thompson,Trip general single.,3.0900000000000003,45.085357088831934
2637,documentary,Charles Jones,Eye prove cover effect million citizen answer do.,2.5700000000000003,41.433816851183686
2638,documentary,Amber Schmitt,Drop yard real attorney level.,2.5300000000000002,46.82791915184498
2639,scifi,Justin Rogers,Accept career serve face assume gas community.,1.8499999999999999,37.05720536713232
2640,documentary,Benjamin Acosta,Along spend everybody finish.,0.4,39.21301508408024
2641,documentary,Jennifer Krueger,Remember writer year federal center off community.,0.94,56.74508089497835
2642,comedy,Suzanne Norton,Down can real choice effect recently father protect.,1.6199999999999999,37.80345728804447
2643,scifi,Michael Frank,End my room and family.,0.54,46.05079563825562
2644,documentary,Jennifer Brown,Pull tonight after run third weight image sign.,2.6700000000000004,49.749870320481925
2645,scifi,John Alexander,Shake change small occur because final military.,0.54,55.83778721138235
2646,comedy,David Martin,Beyond bank discuss.,0.9099999999999999,52.261053272110196
2647,romance,Kristin Dennis DDS,Serious marriage people outside add sense available.,1.66,50.25861072460034
2648,scifi,Jamie Coleman,Change skin business song school.,0.8600000000000001,40.506113344060466
2649,comedy,Alexandra Allen,Gun decide through sell.,3.0100000000000002,53.505035225311495
2650,documentary,Amy Rodriguez,Hope pretty power operation.,0.9199999999999999,43.28999052057503
2651,comedy,Amy Thomas,White seat station senior grow.,2.6300000000000003,66.51716406551346
2652,comedy,Toni Wells,Program popular right hour later entire be.,0.8300000000000001,66.84935343680309
2653,comedy,Ricardo Rowland,Education relationship song paper attorney.,0.77,45.47039167490483
2654,documentary,Gabriel Thomas,Sort return it you possible manager middle service.,0.41000000000000003,37.059280626348134
2655,romance,Chelsea Miles,Manager effect likely per positive past.,2.89,47.163813090157475
2656,comedy,Hayley Brown,Tough suggest car dog too.,2.41,57.97041489748912
2657,documentary,John Padilla,Prevent involve woman most individual instead become.,0.25,43.604191261522246
2658,romance,Daniel Wheeler,Work many could news president foreign film.,2.95,46.70265613162304
2659,comedy,Richard White,Thank they audience.,1.64,31.13534839590192
2660,romance,Tiffany Steele,Six language animal audience trouble.,1.07,37.93349572349749
2661,romance,Brittany Johnson,Material which say attack interest day cover tonight.,2.22,45.63718229655066
2662,scifi,Jeremy Rasmussen,Fact themselves activity.,2.4000000000000004,45.29447616883487
2663,documentary,Jennifer Valenzuela,Those cultural myself age finally bill analysis Mrs.,2.5100000000000002,42.67276127914323
2664,scifi,Amy Taylor,Report notice single car apply show support bit.,2.99,40.694964681950275
2665,documentary,Kevin Obrien,Performance law finish tough.,2.0700000000000003,41.34249491306709
2666,romance,Candice Clark,Should material word such outside different.,3.1900000000000004,35.237129126536395
2667,scifi,Katherine Young,Down answer letter.,2.18,42.89425188262754
2668,documentary,Diane Green,Foreign off manager keep.,2.09,67.28568238087469
2669,romance,Teresa Powell,Wish fear then television tough structure ahead.,0.73,48.17814220601011
2670,documentary,Zachary Perry,Act moment open director find.,0.8300000000000001,69.79769059239361
2671,comedy,Jonathan Webb,Across early since buy.,2.41,53.48316007545626
2672,comedy,Hannah Carroll,Kind weight until respond huge case.,1.3,57.78531525287597
2673,romance,Maria Fisher,Technology party smile focus government mention already end.,0.73,48.1813013504071
2674,documentary,Charles Gutierrez,Also resource paper wife perform home what.,0.72,51.404236790595135
2675,romance,Matthew Owens,Campaign produce affect magazine wide participant debate.,0.63,59.70519676556274
2676,romance,Jennifer Lin,Network identify born a.,1.7,56.879908945078085
2677,romance,Corey Mendez,Occur sure drop TV.,1.92,64.96744349806328
2678,comedy,George Brown,Technology professor condition animal share despite concern.,1.04,43.66642945839907
2679,romance,John Snyder,Bit glass certain others their.,1.82,59.09718436826324
2680,documentary,Jason Edwards,Official always range someone student role.,2.2600000000000002,43.64392033344968
2681,documentary,Kaitlyn Miller,Talk huge east.,0.53,58.677503992519064
2682,romance,Lisa Peterson,Bar authority guess back ahead cost wind interest.,2.87,49.052527870090096
2683,documentary,Benjamin Andrews,Miss throw blood ask prevent.,2.13,45.46405194654044
2684,scifi,Bernard Thomas,Available well federal according resource happen scientist weight.,2.7800000000000002,56.53389322543042
2685,romance,Nathaniel Hernandez,Season environmental either machine read around visit.,2.9200000000000004,67.0765324150145
2686,comedy,Brian Morales,Us list building per involve.,0.61,55.78524031761068
2687,documentary,Charles Mcbride,Smile quickly lot new night note.,0.21000000000000002,39.318228752822776
2688,scifi,Timothy Rodriguez,Final member door create.,2.89,55.13139369952185
2689,comedy,Lauren Shelton,Term several use interest key although receive.,0.98,65.91837571724572
2690,documentary,Jeffrey Williams,Become two evidence name design far company.,3.1500000000000004,39.06502847684288
2691,romance,Ian Scott Jr.,Open finish near situation nice.,2.45,42.12369141969917
2692,documentary,Lynn Hernandez,Size fund along field keep their.,1.88,44.84373471570039
2693,romance,Erin Owen,Challenge in everything everything.,3.06,69.03788116837083
2694,comedy,Stephanie Scott,According against white information move.,3.08,52.569088370847254
2695,documentary,Lisa Lee,Grow alone section feeling water idea finish.,2.12,44.441506351631055
2696,romance,Michelle Burke,Someone sell car seem society drug build.,1.5,54.20058013180696
2697,romance,Monique Montgomery,Energy how partner clearly out difficult item.,1.07,51.403981232922774
2698,comedy,Bobby Avila,Or foreign establish language imagine.,2.02,35.18177273955425
2699,documentary,Angela Barrera,Visit strategy expert travel until.,0.62,62.04432455402452
2700,documentary,Harry Atkins,American character school place small firm.,2.5300000000000002,53.58115832396693
2701,comedy,Alejandro Bryant,Just image season why pick.,0.77,46.36491128183694
2702,comedy,Brenda Daniel,Onto bring successful performance form little sort.,1.22,57.67448453197444
2703,scifi,Michael Key,Near pretty mean family computer government.,0.22,53.61936675417804
2704,romance,Johnny Cowan,Resource above nor view ok sister number understand.,2.8000000000000003,75.2219092941474
2705,romance,Eugene Rodriguez,Citizen focus could instead sound doctor industry.,2.18,40.651481085472476
2706,scifi,George Fletcher,Where determine business democratic everybody sometimes.,3.18,78.58440153526293
2707,documentary,Kelly Farmer,Black either land number role take.,3.0300000000000002,40.39883178539522
2708,scifi,Caitlin Ingram,Success decision state its.,3.16,63.302005560613736
2709,scifi,Mark Medina,Interesting main together area challenge.,1.55,61.55309402456851
2710,romance,Miguel Schneider,Generation game analysis hard people.,2.19,46.273250480873806
2711,romance,Nicole Sandoval,Understand their yeah scientist.,3.02,40.491605098220155
2712,romance,Kevin Hansen,Continue will lay interesting debate.,2.99,54.64324984115577
2713,documentary,James Solis,Most determine enough push agency into.,1.51,48.10651189479714
2714,documentary,Steven Sanders,Base listen brother student.,0.5900000000000001,55.543406971388535
2715,scifi,Anthony Shelton,Baby break modern boy stuff.,1.91,45.64867886687436
2716,romance,John Lynch,Society behind less fire while foreign kitchen.,0.4,55.31306586846358
2717,scifi,Kimberly Daniels,Education over wear show agreement.,0.5,44.213344673266896
2718,comedy,Alexander Garza,Evidence security yard so wish improve Mrs.,0.44,40.44138654982965
2719,romance,Kevin Cordova,Understand cost market author in perhaps.,3.06,34.595826415524826
2720,documentary,Craig Weaver,Peace market lot bring thus.,0.8899999999999999,34.914982734234194
2721,comedy,Candice Gonzalez,Teacher indicate across TV this.,2.23,32.382688960412835
2722,documentary,Shannon Adams,Something wrong society life ok product yeah budget.,0.9199999999999999,34.12974059485043
2723,comedy,Joshua Quinn,Step quickly when.,2.5900000000000003,61.22937769734588
2724,scifi,Christopher Cortez,Thank medical design win get collection fast.,1.3699999999999999,50.11778394130052
2725,documentary,Bobby Reid,Song TV include none partner night.,2.79,78.14761595182813
2726,scifi,Michele Thompson,Short necessary lawyer produce like.,2.7,58.29386288908367
2727,scifi,Edward Hernandez,Than white sure four without present listen source.,2.5300000000000002,49.08338981080033
2728,comedy,Andrea Whitaker,Evidence increase serve bit trip.,1.54,43.56281937837484
2729,documentary,Aimee Mathews,Company past surface size agent create.,3.14,70.41064088169436
2730,romance,Susan Burton,Knowledge protect start fly drug wish professor.,1.75,45.32211389456147
2731,romance,Samantha Juarez,Pretty political training nothing north.,1.4,44.19927223058847
2732,comedy,Joseph Collins,Simply blood weight statement.,0.8,56.18158385101095
2733,romance,Johnathan Pearson,Bank him to theory sound always sense bit.,2.93,47.476961807055226
2734,romance,George Pineda,Quality sister know rock consumer.,2.11,39.84452837857338
2735,documentary,Donna White,Responsibility conference money they court.,2.93,32.52760980075703
2736,romance,Jeffrey Turner,Deep write story.,2.39,57.634488934835666
2737,documentary,Jonathan Rice,Happy four win between.,2.93,61.15504318955405
2738,comedy,Herbert Murray,Among without happen single gun.,0.54,45.26898684352022
2739,romance,Dave Hamilton,Candidate collection last claim move ball religious.,2.58,60.43937862215411
2740,scifi,Brittany Robinson,Program their police chance area.,1.95,42.08316204873574
2741,romance,Justin Nelson,Position require can board media.,1.29,51.41222134349048
2742,scifi,Karen Davis,Walk tough others keep news.,2.5500000000000003,41.314455308290356
2743,documentary,Mariah Wilson,Management play American sell.,2.23,56.63510000065505
2744,documentary,Elizabeth Colon,Young money single detail grow away box son.,1.8699999999999999,58.23302365834083
2745,romance,Margaret Barnes,Debate how risk vote listen though.,0.98,57.136575306912775
2746,scifi,Heidi Singh,Account begin knowledge election on.,1.82,56.559543511785066
2747,documentary,Amanda Knight,Board mother ball site degree.,0.42000000000000004,43.735398164353875
2748,scifi,Rebecca Gonzalez,Manage edge that capital.,2.58,56.87820685812102
2749,scifi,Kayla King,Low career table good cover.,0.98,65.5098106443245
2750,scifi,Colleen Contreras,Baby those couple phone agency.,1.19,47.49699533403746
2751,comedy,Joel Rios,Guy on rest you word.,0.33,38.31250911744421
2752,documentary,Terry Hill,Couple firm sense before situation although fine.,2.7,64.27914792418602
2753,comedy,Michael Cole,Bag measure behavior sing same.,1.07,48.95178289326818
2754,comedy,Matthew Gibson,Understand issue weight.,0.62,41.05099656032957
2755,comedy,Daniel Johnson,Study walk business hope interesting statement finish.,1.06,39.45315968725261
2756,comedy,Jill Medina,Beat eat economy government most.,2.17,57.34113917450137
2757,comedy,Johnny Jackson,Everything drug amount live fine stage nothing sing.,1.07,69.6910526196447
2758,documentary,Brandon Miller,Big safe next increase evening college.,2.11,49.29678493139326
2759,comedy,Mr. Joseph Garrett,Sort floor from stuff.,2.8800000000000003,48.505011958424454
2760,romance,Rhonda Oconnor,Adult choose leg time doctor benefit.,2.3600000000000003,43.75020902758202
2761,documentary,Kelly Morales,Suffer party page unit paper something step.,0.65,66.37243792048879
2762,comedy,Claudia Knight,Hope dream throw carry teach participant.,0.5,52.487417530249026
2763,documentary,Virginia Wallace,Yeah herself member window this agreement.,2.81,56.90750676905485
2764,romance,Mary Davis MD,Argue science staff argue learn great public.,3.06,41.85538532005552
2765,comedy,Richard King,Surface usually his.,2.5700000000000003,59.27262851601115
2766,scifi,Tiffany Joseph,Tend ready may difficult instead without.,2.8000000000000003,42.62364786674396
2767,documentary,Debbie Perry,Open pay college.,0.63,52.77328559468941
2768,romance,Michael Price,Positive little region crime PM land early.,2.54,56.30935878906845
2769,romance,Bobby Johnson,One anything write science.,2.17,50.22189090425077
2770,comedy,Eric Chavez,Heart north ever guess.,0.8800000000000001,32.79580776952484
2771,scifi,Luis Mckinney,Security poor society final performance.,2.0500000000000003,65.14419011014105
2772,documentary,Samuel Williamson,Law threat have way on fund.,0.78,37.15482507980818
2773,scifi,Melissa Baxter,Investment most person member like.,1.95,59.785807576434514
2774,scifi,Amy Erickson,Walk college people foreign piece them century.,1.5899999999999999,44.60331550341926
2775,documentary,Jeffrey Warner,Interesting source building shoulder employee know.,1.19,49.51414708259563
2776,scifi,Jessica Crawford,Home painting ask behind big.,1.8,46.20939060573188
2777,documentary,Katherine Smith,Player share foreign natural mention staff hundred recently.,1.93,52.85045803794101
2778,romance,Phillip Chandler,State material human pull work.,1.3599999999999999,42.37266274678619
2779,comedy,Tina Martinez,Sell offer adult pressure.,0.52,48.27801434037426
2780,romance,Ralph Allen DDS,Nice every appear professional.,0.24000000000000002,54.29759271628926
2781,documentary,Sarah Smith,Guess different put TV method as sure.,1.48,63.49132735553866
2782,scifi,Clayton Rodriguez,Remain east table worker join particularly enter.,0.4,71.17684652235815
2783,romance,Cassandra Obrien,Also development door total lead.,1.45,64.99134283751299
2784,scifi,Trevor Brown,Produce defense age customer either health.,2.77,57.015429775612745
2785,romance,Justin Tucker,Site minute likely participant factor front camera.,1.38,55.37285478925677
2786,scifi,Mitchell Bates,Decade protect scene watch figure sign great.,1.57,48.044320253162475
2787,scifi,Stephanie Martin,Fall financial effect company one lead available.,2.87,50.60405159408894
2788,comedy,Ronald Dickerson,Step from produce.,2.3600000000000003,46.96601842645164
2789,scifi,Dillon Chandler,Way degree evening always.,0.77,52.983833408809815
2790,romance,David Johnston,Most property against probably thought.,0.98,56.049032591682405
2791,documentary,Curtis Huber,What citizen pass television exactly.,1.3599999999999999,47.96748977196528
2792,romance,Andrew Oconnor,Third fund close green air.,1.3499999999999999,47.16831308438449
2793,scifi,Todd Graham,Fish authority thought development thank.,2.58,51.872426828259385
2794,documentary,William Reed,Manager lead exactly.,0.5,68.51813476834865
2795,scifi,Alexandria Larsen,Box go four compare.,1.72,42.126162636543754
2796,comedy,Jason Poole,Level young see stock father lot page.,2.6900000000000004,59.78813670097001
2797,scifi,Katherine Brown,Week someone together will newspaper child size.,2.8200000000000003,40.38312128223031
2798,romance,Mr. Michael Underwood,So discover owner amount deal car.,2.3600000000000003,45.66488581569971
2799,romance,Scott Barker,Voice true American plan computer often.,1.3699999999999999,28.751696027540014
2800,romance,Justin Cooper,Threat charge art wife activity and only attorney.,1.5799999999999998,56.83891639785528
2801,documentary,Pamela Wilson,Finally popular partner child benefit require into.,2.23,41.76504631120923
2802,documentary,April Gilmore,Everyone fish almost future small.,0.77,42.09369474852033
2803,scifi,Dwayne Brown,Around exactly whatever official lawyer according audience.,1.01,42.74458556081707
2804,romance,Willie Moore,Firm movement value free feel head argue lay.,2.37,46.0599661967813
2805,documentary,Luis Smith,Nature thousand American it international loss.,0.64,49.22157514149132
2806,romance,Ms. Dawn White,Stop business different him fast.,1.68,49.02245900391846
2807,scifi,Hailey Foster,Wrong serious political particularly Republican election need forward.,0.73,64.53055744096518
2808,documentary,Joseph Bates,Black few strong society hear reach.,1.21,49.69306318620559
2809,comedy,Angela Hodges,Course say watch little fight machine.,1.26,51.40388721436349
2810,comedy,Aaron Dixon,Fact research success summer discover much section.,0.8899999999999999,50.94725025762171
2811,romance,Jerry Martin,Long government suddenly down.,2.56,52.82147804167562
2812,documentary,Paula Armstrong,Recently surface area move pull.,1.7,49.968435252098885
2813,scifi,Anthony Jacobson,Business produce we how tree once factor.,2.6700000000000004,58.012433147532484
2814,comedy,Eileen Smith,Her race impact me our toward American activity.,0.7,63.86249982947969
2815,romance,Elizabeth Hall,Successful program need huge dark.,1.08,50.493500965793714
2816,comedy,Lee Shelton,Relate science economic present knowledge.,0.8200000000000001,63.385153212574814
2817,romance,William Sparks,Light size middle Mr.,2.0500000000000003,72.92717499136381
2818,romance,Madeline King,Strong hold claim exist will fear.,0.21000000000000002,60.159995789553136
2819,romance,Kelly Herrera PhD,Break never present charge mean.,1.52,69.71580445071672
2820,scifi,Christine Robinson,Fund future job imagine expert every.,0.4,63.35322196383942
2821,scifi,Brandon Perez,Picture trade station begin college.,1.23,56.074049214172994
2822,documentary,Randy Wright,Live year for plan boy admit.,0.33,59.962058301437125
